10:24,-1,ανεκτοτερον εσται εν τη ημερα εκεινη,λεγω υμιν οτι σοδομοισ εν τη ημερα εκεινη ανε εσται η τη πολει εκεινη ,λεγω υμιν οτι σοδομοισ εν τη ημερα εκεινη ανεκτο εσται η τη πολει εκεινη ,λεγω δε υμειν οτι σοδομοισ ανεκτοτερον εσται εν τη βασιλεια του θεου η τη πολει εκεινη ,-1,-1,-1,-1,-1,-1,-1,-1,-1,λεγω υμιν οτι σοδομοισ εν τηι ημ εκεινηι αν εσται η τηι πολει εκεινηι ,λε υμιν οτι σοδομοισ εν τη η εκεινη ανεκτοτερον εσται η τη πολει εκεινη ,λεγω υμιν οτι σοδομοισ εν τη ημερα εκεινηι ανεκτο εσται η τηι πολει εκεινη ,λεγω υμιν οτι σοδο ανεκτοτερον ε σται εν τη ημερα εκεινη η τη πολη εκεινη ,εν τη ημερα εκεινη ανεκτοτερον εσται,λεγω δε υμιν οτι σοδομοισ εν τηι ημεραι εκεινηι ανεκτοτερον εσται η τηι πολει ε ,εν τη ημερα εκεινη ανεκτοτερον εσται,ανεκτοτερον εσται εν τη ημερα εκεινη,-1,λεγω υμιν οτι σοδομοισ εν τη ημερα εκεινη ανεκτοτερον ε η τη πολει εκεινη ,εν τη ημερα εκεινη ανεκτοτερον εσται,εν τη ημερα εκεινη ανεκτοτερον εσται,εν τη ημερα εκεινη ανεκτοτερον εσται
10:25,-1,ουαι σοι χοραζειν ουαι σοι βηδσαιδα οτι ει εν τυρω και σειδωνι εγενοντο αι δυνα αι γενομεναι εν υμιν παλαι αν εν σακκω και σποδω καθημενοι μετενοησαν ,βηθσαιδα,βηθσαιδα,ουαι σοι χοροζαιν και βηδσαιδα οτι ει εν τυρω και σιδωνι εγενηθησαν αι δυναμεισ αι γενομεναι εν υμειν παλαι αν εν σακκω και σποδω καθημεναι μετενοησαν ,-1,-1,-1,-1,-1,-1,-1,-1,-1,βηθσαιδαν,ουαι σοι χοραζειν ουαι σοι βηδσαιδα οτι ει εν τυρω και σιδονι εγεννηθησαν αι δυνα αι γενομεναι εν υμιν παλαι αν εν σακκω και σποδω καθημε μετενοησαν ,βηθσαιδαν,βηθσαιδαν,βηθσαιδα,ουαι σοι χοραζιν ουαι σοι βηθσα οτι ει εν τυρωι και σιδωνι εγενον αι δυναμεισ αι γενομεναι εν υμιν πα αν εν σακκωι και σποδωι καθημεναι μετενοησαν ,βηθσαιδα,ουαι σοι χωραζην ουαι σοι βιθσαιδαν οτι ει εν τυρω και σιδωνη εγενηθησαν αι δυναμεισ αι γινωμεναι εν υμιν παλαι αν εν σα και σποδω καθημενοι μετενοησαν ,-1,βηθσαιδαν,ουαι σοι χωραζιν ουαι σοι βιθσαιδα οτι ει εν τυρω και σιδωνι εγενοντο αι δυναμεισ αι γενομεναι εν υμιν παλαι αν εν σακκω και σποδω καθημενοι μετενοησαν ,βηθσαιδα,βηθσαιδα
10:26,-1,εγενοντο,ου σοι χοραζειν ουαι σοι βηδσαιδα βηθσαιδα οτι ει εν τυρω και σειδωνι σιδωνι εγε αι δυναμεισ αι γενομεναι εν υμιν παλαι αν εν σακκω και σποδω καθημενοι με ,εγενοντο,εγενηθησαν,-1,-1,-1,-1,-1,-1,-1,-1,-1,ουαι σοι χοραζειν ουαι σοι βηθσαιδαν οι εν τυρωι και σειδωνι εγεησα αι δυναμεισ αι γενο εν υμιν παλαι αν εν σακκωι κ σποδωι καθημεναι μετενοησαν ,ουαι σοι χοραζειν ουαι σοι βηδσαιδα οτι ει εν τυρω και σιδονι εγεννηθησαν αι δυνα αι γενομεναι εν υμιν παλαι αν εν σακκω και σποδω καθημε μετενοησαν ,εγενοντο,ουαι σοι χοραζειν ου σοι βηθσαιδαν οτι ει εν τηρω και σιδωνη εγε αι δυναμεισ αι γενομεναι εν υμιν πα αν εν σακκω και σπο καθημενοι μετενο ,εγενοντο,ουαι σοι χοραζιν ουαι σοι βηθσα οτι ει εν τυρωι και σιδωνι εγενον αι δυναμεισ αι γενομεναι εν υμιν πα αν εν σακκωι και σποδωι καθημεναι μετενοησαν ,εγενηθησαν,εγενηθησαν,-1,εγενοντο,εγενοντο,εγενοντο,εγενοντο
10:27,-1,πλην τυρω και σιδωνι ανε εσται εν τη κρισει η υμιν ,πλην τυρω και σειδωνι σιδωνι ανεκτο εσται εν τη κρι η υμιν ,ανεκτοτερον εσται εν τη κρισει,πλην τυρω και σιδωνι ανεκτοτερον εσται ημειν υμειν ,-1,-1,-1,-1,-1,-1,-1,-1,-1,πλην τυρωι και σεδω ανεκτοτερον εσται η υμιν ,ανεκτοτερον εσται εν τη κρισει,πλην τυρω και σιδωνι εν τηι κρισει ανεκτο εσται η υμιν ,πλην τυρω και σι ανεκτοτερον εσται εν ημερα κρισεωσ η υμιν ,πλην τυρω και σιδωνι α εσται εν τη κρισει η υμιν ,πλην τυρωι και σιδωνι ανε εσται εν τηι κρισει η υμιν ,ανεκτοτερον εσται εν τη κρισει,πλην τυ και σιδονη ανεκτοτερον εσται εν ημερα κρισεωσ η υμιν ,-1,πλην τυρω και σιδωνι ανε κτοτερον εσται εν τη κρισει η υμιν ,ανεκτοτερον εσται εν τη κρισει,ανεκτοτερον εσται εν τη κρισει,ανεκτοτερον εσται εν τη κρισει
10:28,-1,εν τη κρισει,πλην τυρω και σειδωνι σιδωνι ανεκτο εσται εν τη κρι η υμιν ,εν τη κρισει,πλην τυρω και σιδωνι ανεκτοτερον εσται ημειν υμειν ,-1,-1,-1,-1,-1,-1,-1,-1,-1,πλην τυρωι και σεδω ανεκτοτερον εσται η υμιν ,εν τη κρισει,πλην τυρω και σιδωνι εν τηι κρισει ανεκτο εσται η υμιν ,εν ημερα κρισεωσ,εν τη κρισει,πλην τυρωι και σιδωνι ανε εσται εν τηι κρισει η υμιν ,εν τη κρισει,εν ημερα κρισεωσ,-1,εν τη κρισει,εν τη κρισει,εν τη κρισει,εν τη κρισει
10:29,-1,υψωθεισα,και συ καφαρ μη η μη εωσ του ουρα υψωθηση υψωθησει υψωθηση εωσ του αδου καταβηση ,υψωθεισα,και συ καφαρναουμ μη εωσ ουρανου υψωθηση η εωσ αδου καταβηση ,-1,-1,-1,-1,-1,-1,-1,-1,-1,και συ καφαρναυ μη εωσ ου υψωθηση και εωσ α καταβιβασθηση ,και συ καφαρα μη εωσ ουρανου υψωθη εωσ του αδου καταβηση ,και συ καπερναουμ η εω του ουρανου υψωθηση η εωσ αδου καταβιβασθηση ,υψωθεισα,υψωθεισα,και συ καπερναουμ η εωσ του ουρανου υψω η εωσ αιδου καταβιβασθησηι ,και συ καφαρναουμ η εωσ του ουρανου υψωθησα εωσ αδου καταβιβασθηση ,και συ καπερναουμ η εωσ του ουρανου υψωθη εωσ αδου καταβιβασθησα ,-1,και συ καπερναουμ η εωσ του ουρανου υ εωσ αδου καταβιβασθηση ,υψωθεισα,υψωθεισα,υψωθεισα
10:30,-1,υμων ακουων,ο α υμων εμου α και ο αθετων υ εμε αθετει ο δε ε αθετων αθετει τον αποστειλαντα με ,ακουων υμων,ακουων υμων,-1,-1,-1,-1,-1,-1,-1,-1,-1,ο αου υμων εμ ακουει και ο υμασ αθετ εμε αθετ ο εμε αθετων αθετει τον αποστειλαντα με ,ο α υμων εμου ακουει και ο αθετων υμασ εμε αθετει ο δε εμε αθετων αθετει τον αποστειλαν με ,ο ακουων υμιν ε ακουει και ο αθετων υμασ εμε αθετει ο δε εμε αθετων αθετει τον απο με ,ακουων υμων,ακουων υμων,ακουων υμων,ακουων υμων,ο ακουων ημων υμων εμου ακουει και ο αθετων υμασ εμε αθετει ο δε εμε αθε αθετει τον αποστειλαντα με ,-1,ακουων υμων,ακουων υμων,ακουων υμων,ακουων υμων
10:31,-1,με,με,με,με,-1,-1,-1,-1,-1,-1,-1,-1,-1,με,με,με,με και ο ακουων εμου ακουει του αποστειλαντοσ με,με,με,με,με,-1,με,με,με,με
10:32,-1,μετα χαρασ οι εβδομηκοντα,υπεστρεψαν δε οι εβδο δυο μετα χα λεγοντεσ κυριε και τα δαιμονια υποτασσε ημιν εν τω ονομα σου ,οι εβδομηκοντα μετα χαρασ,υπεστρεψαν δε οι οβ μετα χαρασ λεγοντεσ κυριε και τα δαιμονια υποτασσεται ημειν εν τω ονοματι σου ,-1,-1,-1,-1,-1,-1,-1,-1,-1,υπεστρεψα δε ο οβ μετα χαρασ λεγοντεσ κυριε και τα δαιμονια υποτασσεται ημιν εν τωι ονοματι σου ,υπεστρεψαν δε οι οβ με χαρασ λεγοντεσ κυριε και τα δαι υποτασσεται ημιν εν τω ονοματι σου ,υπεστρεψαν δε οι ευδο μετα χαρασ λεγοντεσ κυριε και τα δαιμονια ημιν υποτασσεται εν τω ο σου ,υπεστρεψαν δε οι εβδο μετα χαρασ μεγαλησ λεγοντεσ κυριε και τα δαιμονια υπο υμιν εν τω ονοματι σου ,οι εβδομηκοντα μετα χαρασ,οι εβδομηκοντα μετα χαρασ,οι εβδομηκοντα μετα χαρασ,υπεστρεψαν δε οι εβ μετα χαρασ λεγοντεσ κυριε και τα δαιμονια υποτασσεται ημιν εν τω ονοματι σου ,-1,οι εβδομηκοντα μετα χαρασ,οι εβδομηκοντα μετα χαρασ,υπεστρεψαν δε οι εβδομηκοντα δυο μετα χαρασ λεγοντεσ κυριε και τα δαιμονια υποτασσεται ημιν εν τω ονοματι σου ,οι εβδομηκοντα μετα χαρασ
10:33,-1,εβδομηκοντα,υπεστρεψαν δε οι εβδο δυο μετα χα λεγοντεσ κυριε και τα δαιμονια υποτασσε ημιν εν τω ονομα σου ,εβδομηκοντα,υπεστρεψαν δε οι οβ μετα χαρασ λεγοντεσ κυριε και τα δαιμονια υποτασσεται ημειν εν τω ονοματι σου ,-1,-1,-1,-1,-1,-1,-1,-1,-1,υπεστρεψα δε ο οβ μετα χαρασ λεγοντεσ κυριε και τα δαιμονια υποτασσεται ημιν εν τωι ονοματι σου ,υπεστρεψαν δε οι οβ με χαρασ λεγοντεσ κυριε και τα δαι υποτασσεται ημιν εν τω ονοματι σου ,υπεστρεψαν δε οι ευδο μετα χαρασ λεγοντεσ κυριε και τα δαιμονια ημιν υποτασσεται εν τω ο σου ,υπεστρεψαν δε οι εβδο μετα χαρασ μεγαλησ λεγοντεσ κυριε και τα δαιμονια υπο υμιν εν τω ονοματι σου ,εβδομηκοντα,εβδομηκοντα,εβδομηκοντα,υπεστρεψαν δε οι εβ μετα χαρασ λεγοντεσ κυριε και τα δαιμονια υποτασσεται ημιν εν τω ονοματι σου ,-1,εβδομηκοντα,εβδομηκοντα,εβδομηκοντα,εβδομηκοντα
10:34,-1,υποτασσεται ημιν,υπεστρεψαν δε οι εβδο δυο μετα χα λεγοντεσ κυριε και τα δαιμονια υποτασσε ημιν εν τω ονομα σου ,υποτασσεται ημιν,υπεστρεψαν δε οι οβ μετα χαρασ λεγοντεσ κυριε και τα δαιμονια υποτασσεται ημειν εν τω ονοματι σου ,-1,-1,-1,-1,-1,-1,-1,-1,-1,υποτασσεται ημιν,υποτασσεται ημιν,ημιν υποτασσεται,υπεστρεψαν δε οι εβδο μετα χαρασ μεγαλησ λεγοντεσ κυριε και τα δαιμονια υπο υμιν εν τω ονοματι σου ,υποτασσεται ημιν,υπεστρεψαν δε οι εβδομηκοντα μετα χαρασ λεγοντεσ κυριε και τα δαιμονια υποτασ ημιν εν τωι ονοματι σου ,υποτασσεται ημιν,υποτασσεται ημιν,-1,υπεστρε δε οι εβδομηκοντα μετα χαρασ λεγοντεσ κυριε και τα δαιμονια υπο ημιν εν τω ονοματι σου ,υποτασσεται ημιν,υποτασσεται ημιν,υπεστρεψαν δε οι εβδομηκοντα μετα χαρασ λεγοντεσ κυριε και τα δαιμονια υποτασσ εται ημιν εν τω ονοματι σου
10:35,-1,αυτη,αυτη,αυτη,αυτη δε,-1,-1,-1,-1,-1,-1,-1,-1,-1,αυτη,αυτη,αυτη,αυτη,αυτη,αυτη,αυτη,αυτη,-1,αυτη δε,αυτη,αυτη,αυτη
10:36,-1,εν ταυτη τη ωρα ηγαλλιασατο τω πνι ο ισ και ειπεν εξομολογουμαι σοι περ κυριε του ουρανου και τησ γησ οτι απεκρυψασ ταυτα απο σοφων και συνετων και απεκαλυψασ αυτα νηπι ναι ο πηρ οτι ουτωσ εγε ευδοκια εμπροσθεν σου ,τω πνευματι τω αγιω,εν αυτη τη ωρα ηγαλλιασατο τω πνι τω αγιω ο ισ και ειπεν εξομολογουμαι σοι περ κυριε του ουρα και τησ γησ οτι απεκρυψασ ταυτα απο σοφων και συνετων και απεκαλυψασ αυτα νηπιοισ ναι ο πηρ οτι ουτωσ ευδοκια εγενετο εγενετο ευδοκια εμπροσθεν σου ,τω πνευματι τω αγιω,-1,-1,-1,-1,-1,-1,-1,-1,-1,εν αυτηι τηι ωρα ηγαλλιασατο εν τωι πνι και ειπεν εξομο σοι πρ κυριε του ουρανου οτι απεκρυψασ ταυτα απο σοφων και συνετων και απεκαλυψασ αυτα νηπιοισ ναι ο πηρ οτι ουτωσ ευδα εγενετο εμπ σου ,εν αυτη τ ωρα ηγ τω πνι τω αγ και ειπ εξομολογουμαι σο πατερ κυριε του ουρανου και τησ γησ οτι εκ ταυτα απο σοφων και συνετ και απεκαλυψασ αυτα νη ναι ο πατηρ οτι ουτωσ ευ εγενετο εμπροσθεν σου ,εν αυτηι τηι ωραι ηγαλλιασατο τω πνι τω αγιωι ο ισ και ει εξομολογουμαι σοι περ κυριε του ουρανου και τησ γησ οτι απεκρυψασ ταυτα απο σοφων και συνετων και απεκαλυψασ αυτα νηπιοισ ναι ο πηρ οτι ουτωσ εγε ευδοκια εμπροσθεν σου ,εν αυτη τη ωρα ηγα ο ισ τω πνι και ειπεν εξομολο σοι περ κυριε του ουρανου και τησ γησ οτι απεκρυψασ ταυτα απο σοφων και συνε και απεκαλυψασ αυτα νηπιοισ ναι ο πηρ οτι ουτωσ εγε ευδοκια εμπροσ σου ,εν αυτη τη ωρα ηγαλλια τω πνι ο ισ και ειπεν εξομολογουμαι σοι περ κυριε του ουρανου και τησ γησ οτι απεκρυψασ ταυτα απο σοφων και συνετων και απε αυτα νηπιοισ ναι ο πηρ οτι ουτωσ εγενετο ευδοκια εμπροσθεν σου ,εν αυτηι τηι ωραι ηγαλλιασατο τωι πνι ο ισ και ειπεν εξομολογουμαι σοι περ κυριε του ουρανου και τησ γησ οτι απε ταυτα απο σοφων και συνετων και απεκαλυψασ αυτα νηπιοισ ναι ο πηρ οτι ουτωσ εγενετο ευδοκια εμπροσθεν σου ,εν αυτη τη ωρα ηγαλλιασατο ο ισ εν τω πνι τω αγιω και ειπεν εξομολογουμαι σοι περ κυριε του ουρανου και τησ γησ οτι απεκρυψασ ταυτα απο σοφων και συνετων και απεκαλυψασ αυτα νηπιοισ ναι ο πηρ οτι ουτωσ ευδοκια εγενετο εμπροσθεν σου ,εν αυτη τη ωρα ηγαλλιασατο τω πνι ο ιησουσ και ειπεν εξομολογουμαι σοι παρ κυριε του ουρανου και τησ γησ οτι απεκρυψασ ταυτα απο σοφων και συνετων και απεκαλυψασ αυτα νηπι ναι ο πηρ οτι ουτωσ εγενετο ευδοκια εμπρο σου ,-1,εν αυτη δε τη ωρα ηγαλλιασατο τω πνι ο ισ και ειπεν εξομολογουμαι σοι περ κυριε του ουρανου και τησ γησ οτι α πεκρυψασ ταυτα απο σοφων και συνε και απεκαλυψασ αυτα νηπιοισ ναι ο πηρ οτι ουτωσ εγενετο ευδοκια εμπροσθεν σου ,εν αυτη τη ωρα ηγαλλιασατο τω πνι ο ισ και ειπεν εξομολογουμαι σοι περ κυριε του ουρανου και τησ γησ εξομολογουμαι σοι περ κυριε του ουρανου και τησ γησ οτι απεκρυψασ ταυτα απο σοφων και συνετων και απεκαλυψασ αυτα νηπιοισ ναι ο πηρ οτι ουτωσ εγενετο ευδοκια εμπροσθεν σου ,εν αυτη τη ωρα ηγαλλιασατο τω πνευματι ο ιησουσ και ειπεν εξομολογουμαι σοι πατερ κυριε του ουρανου και τησ γησ οτι απεκρυψασ ταυτα απο σοφων και συνετων και απεκαλυψασ αυτα νηπιοισ ναι ο πατηρ οτι εγενετο ουτωσ ευδοκια εμπροσθεν σου ,εν αυτη τη ωρα ηγαλλιασατο τω πνευματι ο ιησουσ και ειπεν εξομολογουμαι σοι πατερ κυριε του ουρανου και τησ γησ οτι απεκρυψασ ταυτα απο σοφων και συνετων και απεκαλυψασ αυτα νηπιοισ ναι ο πατηρ οτι ουτωσ εγενετο ευδοκια εμπροσθεν σου
10:37,-1,παντα,παντα,και στραφεισ προσ τουσ μαθητασ αυτου ειπεν παν μοι παρε υπο του πρσ μου και ουδεισ επιγινωσκει τισ ε ο υιοσ ει μη ο πηρ και τισ εστιν ο πηρ ει μη ο υσ και ω εαν βουληται ο υσ αποκαλυψαι ,παντα,-1,-1,-1,-1,-1,-1,-1,-1,-1,παντα,π μοι παρεδοθη υπο του πρσ μου και ουδεισ γεινωσκει τισ εστιν ο υσ ει μη ο πρ και τισ εστιν ο πρ ει μη ο υσ και ω εαν βουληται ο υιοσ αποκαλυψαι ,παντα,παντα,και στραφεισ προσ τουσ μαθητασ ειπε παντα,παντα,παντα,παντα,-1,παντα,και ουδεισ γινωσκει τισ εστιν ο υιοσ ει μι ο πηρ και τισ εστιν ο πηρ ει μη ο υιοσ και ω εαν βουληται ο υιοσ αποκαλυψαι ,παντα,παντα
